S000002831,YDR423C,CAD1,1.0,7.30925703049,7.30925703049,[7.309257],www.pubmed.com/17130146,"AP-1-like basic leucine zipper (bZIP) transcriptional activator; involved in stress responses, iron metabolism, and pleiotropic drug resistance; controls a set of genes involved in stabilizing proteins; binds consensus sequence TTACTAA; CAD1 has a paralog, YAP1, that arose from the whole genome duplication"
S000005871,YOR344C,TYE7,2.0,7.12176978588,3.56088489294,"[1.9181837, 5.2035861]",www.pubmed.com/19111667,Serine-rich protein that contains a bHLH DNA binding motif; binds E-boxes of glycolytic genes and contributes to their activation; may function as a transcriptional activator in Ty1-mediated gene expression; bHLH stands for basic-helix-loop-helix
S000006219,YPR015C,,3.0,6.94717097282,2.31572365761,"[0.68415475, 2.6496921, 3.6133242]",www.pubmed.com/18842628,Putative zinc finger transcription factor; binds DNA in sequence-specific manner; overexpression causes a cell cycle delay or arrest
S000003064,YGL096W,TOS8,1.0,5.66789340973,5.66789340973,[5.6678934],www.pubmed.com/19111667,"Homeodomain-containing protein and putative transcription factor; found associated with chromatin; target of SBF transcription factor; induced during meiosis and under cell-damaging conditions; TOS8 has a paralog, CUP9, that arose from the whole genome duplication"
S000002530,YDR123C,INO2,3.0,5.5420165658,1.84733885527,"[0.54151291, 0.9044019, 4.0961018]",www.pubmed.com/16522208,"Transcription factor; component of the heteromeric Ino2p/Ino4p basic helix-loop-helix transcription activator that binds inositol/choline-responsive elements (ICREs), required for derepression of phospholipid biosynthetic genes in response to inositol depletion; involved in diauxic shift"
S000002871,YDR463W,STP1,1.0,5.42351818085,5.42351818085,[5.4235182],www.pubmed.com/16522208,"Transcription factor; contains a N-terminal regulatory motif (RI) that acts as a cytoplasmic retention determinant and as an Asi dependent degron in the nucleus; undergoes proteolytic processing by SPS (Ssy1p-Ptr3p-Ssy5p)-sensor component Ssy5p in response to extracellular amino acids; activates transcription of amino acid permease genes and may have a role in tRNA processing; STP1 has a paralog, STP2, that arose from the whole genome duplication"
S000001807,YKR099W,BAS1,3.0,5.03804588318,1.67934862773,"[0.28169018, 0.54865068, 4.207705]",www.pubmed.com/18842628,Myb-related transcription factor; involved in regulating basal and induced expression of genes of the purine and histidine biosynthesis pathways; also involved in regulation of meiotic recombination at specific genes
S000001098,YHR056C,RSC30,2.0,4.52177456021,2.26088728011,"[0.20130137, 4.3204732]",www.pubmed.com/19111667,"Component of the RSC chromatin remodeling complex; non-essential gene required for regulation of ribosomal protein genes and the cell wall/stress response; null mutants are osmosensitive; RSC30 has a paralog, RSC3, that arose from the whole genome duplication"
S000005864,YOR337W,TEA1,1.0,3.97532200813,3.97532200813,[3.975322],www.pubmed.com/19111667,Ty1 enhancer activator involved in Ty enhancer-mediated transcription; required for full levels of Ty enhancer-mediated transcription; C6 zinc cluster DNA-binding protein
S000000150,YBL054W,TOD6,1.0,2.83105635643,2.83105635643,[2.8310564],www.pubmed.com/18842628,PAC motif binding protein involved in rRNA and ribosome biogenesis; subunit of the RPD3L histone deacetylase complex; Myb-like HTH transcription factor; hypophosphorylated by rapamycin treatment in a Sch9p-dependent manner; activated in stochastic pulses of nuclear localization
S000001595,YKL112W,ABF1,1.0,2.51796317101,2.51796317101,[2.5179632],www.pubmed.com/19111667,"DNA binding protein with possible chromatin-reorganizing activity; involved in transcriptional activation, gene silencing, and DNA replication and repair"
S000004565,YML099C,ARG81,1.0,1.01627755165,1.01627755165,[1.0162776],www.pubmed.com/16522208,Zinc finger transcription factor involved in arginine-responsive genes; Zn(2)-Cys(6) binuclear cluster domain type; involved in the regulation of arginine-responsive genes; acts with Arg80p and Arg82p
S000004121,YLR131C,ACE2,1.0,0.574784100056,0.574784100056,[0.5747841],www.pubmed.com/19111667,"Transcription factor required for septum destruction after cytokinesis; phosphorylation by Cbk1p blocks nuclear exit during M/G1 transition, causing localization to daughter cell nuclei, and also increases Ace2p activity; phosphorylation by Cdc28p and Pho85p prevents nuclear import during cell cycle phases other than cytokinesis; part of RAM network that regulates cellular polarity and morphogenesis; ACE2 has a paralog, SWI5, that arose from the whole genome duplication"
